{"schema_version":1,"tool_name":"submit_recommendation","ok":false,"timestamp":"2026-08-04T20:49:26Z","correlation_id":"gate05-step03-20260804T204600Z-969127-preamble","data":null,"error":{"code":"ALT_TEXT_PREAMBLE","message":"proposed_alt_text contains an obvious model preamble.","retryable":false}}