{"schema_version":1,"tool_name":"submit_recommendation","ok":false,"timestamp":"2026-08-04T20:49:27Z","correlation_id":"gate05-step03-20260804T204600Z-969127-filename","data":null,"error":{"code":"ALT_TEXT_FILENAME_ECHO","message":"proposed_alt_text is a filename or filename echo.","retryable":false}}