{"schema_version":1,"tool_name":"submit_recommendation","ok":false,"timestamp":"2026-08-04T20:49:25Z","correlation_id":"gate05-step03-20260804T204600Z-969127-source","data":null,"error":{"code":"INVALID_SOURCE_FRAMEWORK","message":"source_framework must be drupal_ai, langgraph, or crewai.","retryable":false}}