{
  "correlation_id": "gate05-step05-20260805T184155Z-50124-context",
  "data": {
    "article": {
      "body_plain": "This is fictional demonstration content for the Drupal GovCon 2026 agentic-harness lab. It contains no real agency, program, resident, client, or operational data. This article explains how residents can assemble supplies, identify evacuation routes, and prepare household contact plans. Its generated illustration uses a solid navy background, a large visible Article 1 identifier, a short topic label, and a primary or supporting-image label. The page and image are intentionally simple so context assembly, target provenance, validation, review, and recovery can be compared reproducibly across frameworks.",
      "content_language": "en",
      "revision_id": 1,
      "title": "Phase 0 01 \u2014 Emergency Preparedness Checklist"
    },
    "collected_at": "2026-08-05T18:43:51Z",
    "evidence_hash": "sha256:9949b114fb2463bade7ac81261740fa64ff4821f873ce1b3576bff9105cbae82",
    "existing_alt": "",
    "image": {
      "byte_length": 4490,
      "file_uuid": "07af2dce-7bfd-5de6-b291-e090669eda25",
      "filename": "phase0-article-01-image-1.png",
      "height": 675,
      "mime_type": "image/png",
      "representation": {
        "kind": "data_url",
        "value": "<runtime-only-data-url>"
      },
      "sha256": "49bdc7c2d792d5839bc36576b6f2de7fb7fa6f6633967ed3a5bbb541cf9676d5",
      "width": 1200
    },
    "schema_version": 1,
    "target": {
      "delta": 0,
      "existing_alt": "",
      "field_name": "field_image",
      "file_uuid": "07af2dce-7bfd-5de6-b291-e090669eda25",
      "node_uuid": "344eb273-ac74-5be8-85fb-6c2efd1f93a6",
      "revision_id": 1,
      "schema_version": 1,
      "sequence": 1,
      "target_state": "missing"
    }
  },
  "error": null,
  "ok": true,
  "schema_version": 1,
  "timestamp": "2026-08-05T18:43:51Z",
  "tool_name": "get_image_context"
}
