{
  "correlation_id": "gate05-step04-20260804T211943Z-994186-replay",
  "data": {
    "node_id": 21,
    "revision_id": 21,
    "run_id": "drupal_ai-20260804T212019Z-95d907",
    "source_framework": "drupal_ai",
    "status": "pending",
    "target": {
      "delta": 0,
      "existing_alt": "",
      "field_name": "field_image",
      "file_uuid": "07af2dce-7bfd-5de6-b291-e090669eda25",
      "node_uuid": "344eb273-ac74-5be8-85fb-6c2efd1f93a6",
      "revision_id": 1,
      "schema_version": 1,
      "sequence": 1,
      "target_state": "missing"
    },
    "uuid": "253392b9-d202-48ee-9709-949c0fb57d62"
  },
  "error": null,
  "ok": true,
  "schema_version": 1,
  "timestamp": "2026-08-04T21:21:19Z",
  "tool_name": "submit_recommendation"
}
