{
  "correlation_id": "gate05-step05-20260805T174126Z-18681-submit",
  "data": {
    "node_id": 21,
    "revision_id": 21,
    "run_id": "drupal_ai-20260805T174329Z-62ef37",
    "source_framework": "drupal_ai",
    "status": "pending",
    "target": {
      "delta": 0,
      "existing_alt": "",
      "field_name": "field_image",
      "file_uuid": "07af2dce-7bfd-5de6-b291-e090669eda25",
      "node_uuid": "344eb273-ac74-5be8-85fb-6c2efd1f93a6",
      "revision_id": 1,
      "schema_version": 1,
      "sequence": 1,
      "target_state": "missing"
    },
    "uuid": "c2144434-6931-4811-b0f6-eeb62d15f026"
  },
  "error": null,
  "ok": true,
  "schema_version": 1,
  "timestamp": "2026-08-05T17:43:29Z",
  "tool_name": "submit_recommendation"
}
