{
  "correlation_id": "gate05-step03-20260804T204600Z-969127-replay",
  "data": {
    "node_id": 21,
    "revision_id": 21,
    "run_id": "drupal_ai-20260804T204710Z-047c42",
    "source_framework": "drupal_ai",
    "status": "pending",
    "target": {
      "delta": 0,
      "existing_alt": "",
      "field_name": "field_image",
      "file_uuid": "07af2dce-7bfd-5de6-b291-e090669eda25",
      "node_uuid": "344eb273-ac74-5be8-85fb-6c2efd1f93a6",
      "revision_id": 1,
      "schema_version": 1,
      "sequence": 1,
      "target_state": "missing"
    },
    "uuid": "44f34994-9553-4128-9e3c-b68dcaeb2414"
  },
  "error": null,
  "ok": true,
  "schema_version": 1,
  "timestamp": "2026-08-04T20:49:21Z",
  "tool_name": "submit_recommendation"
}
